{
  "version": "1.0.0",
  "subject": "science",
  "gradeLevel": 5,
  "unit": "太陽的秘密",
  "questions": [
    {
      "id": "stage-1-azimuth-inverse",
      "stageId": 1,
      "type": "shadow_alignment",
      "misconceptionTarget": "方位同向謬誤（以為影子在北方太陽就在北方）",
      "prompt": "【逆光雷射盲盒】大霧遮蔽天空！標竿長影指向【西北西方】。請操控探測車砲塔瞄準天空，找出背光隱藏的太陽！",
      "environmentConfig": {
        "sunAltitude": 25,
        "sunAzimuth": 112.5,
        "season": "spring_autumn",
        "timeHour": 8
      },
      "options": ["西北西方", "東南東方", "西南西方", "正天頂 (90°)"],
      "correctAnswer": 1,
      "poeFeedback": {
        "predictionFail": "注意！光是直線傳播的，影子是背光產生的投影。影子指向西北西，太陽必在相反方向！",
        "scientificExplanation": "光線沿直線前進，影子與太陽方位呈 180° 相反對稱（太陽、竿頂、影端三點共線）。影子指向西北西，太陽必定在【東南東方】！"
      }
    },
    {
      "id": "stage-2-altitude-inverse",
      "stageId": 2,
      "type": "angle_tuning",
      "misconceptionTarget": "高度角正比謬誤（以為中午太陽最高最大，影子一定最長）",
      "prompt": "【光能縮影門鎖】大門前有半徑 0.5m 的能量圈。滑動調節太陽高度角，將影子縮進光圈解鎖大門！",
      "environmentConfig": {
        "sunAltitude": 20,
        "sunAzimuth": 180,
        "season": "spring_autumn",
        "timeHour": 12
      },
      "options": ["拉低到 20° (長影)", "拉升到 67° 以上 (短影)", "拉低到 10°", "高度角對影長無影響"],
      "correctAnswer": 1,
      "poeFeedback": {
        "predictionFail": "拉桿往下拉時，太陽愈低，影子變得更長了！直角三角形反比模型中，高度角愈大影子才會愈短！",
        "scientificExplanation": "依據三角投影幾何 (tan θ = h/L)，太陽高度角 θ 愈高，地表影長 L 愈短；正午高度角最高時，影子達到全日最短！"
      }
    },
    {
      "id": "stage-3-winter-solstice-noon",
      "stageId": 3,
      "type": "spatial_choice",
      "misconceptionTarget": "正午必在天頂 (90°) 之文化語義謬誤",
      "prompt": "【冬至正午巡天】臺灣嘉義冬至正午 12:00。旗桿長影筆直指向正北。請切換巡天鏡尋找太陽真實位置！",
      "environmentConfig": {
        "sunAltitude": 43,
        "sunAzimuth": 180,
        "season": "winter",
        "timeHour": 12
      },
      "options": [
        "正頭頂天頂 (仰角 90°)",
        "南方天空斜上方 (仰角約 43°)",
        "北方地平線",
        "東方地平線"
      ],
      "correctAnswer": 1,
      "poeFeedback": {
        "predictionFail": "瞄準正頭頂天頂無任何能量！若太陽在天頂，影子長度應縮為 0。既然長影指向北，太陽必在南方半空！",
        "scientificExplanation": "臺灣全境位於北回歸線附近，全年中只有夏至正午太陽直射天頂。冬至正午太陽顯著偏向南方天空（高度角約 43°），因此會形成長長偏北的影子！"
      }
    },
    {
      "id": "stage-4-protractor-base",
      "stageId": 4,
      "type": "spatial_choice",
      "misconceptionTarget": "量角器空間放置基線與圓心錯誤",
      "prompt": "【3D 磁吸量角器】請將量角器吸附到正確錨點：0度基線必須平貼地表、圓心必須對齊影端！",
      "environmentConfig": {
        "sunAltitude": 45,
        "sunAzimuth": 225,
        "season": "spring_autumn",
        "timeHour": 14
      },
      "options": [
        "圓心掛在竿頂，基線懸空在空中",
        "圓心對齊影端地表，基線水平平貼地面",
        "量角器隨意擺放",
        "量角器貼在車窗上"
      ],
      "correctAnswer": 1,
      "poeFeedback": {
        "predictionFail": "量角器如果掛在竿頂，基線就懸在空中了！太陽高度角是光線與「水平地面」的夾角，基線必須平貼地面！",
        "scientificExplanation": "太陽高度角是指「入射光線與水平地平面之夾角」。量角器基線必須平貼地面，圓心對齊影端，自竿頂拉線測量度數！"
      }
    },
    {
      "id": "stage-5-solar-panel-boost",
      "stageId": 5,
      "type": "angle_tuning",
      "misconceptionTarget": "四季冷暖與光照入射角（直射與斜射）之通量原理",
      "prompt": "【向日葵光能衝刺】轉動雙軸太陽能板垂直正對太陽（直射），蓄滿 100% 能量啟動氮氣噴射衝刺！",
      "environmentConfig": {
        "sunAltitude": 50,
        "sunAzimuth": 200,
        "season": "summer",
        "timeHour": 13
      },
      "options": ["水平放置 (斜射低效)", "垂直正對太陽 (直射滿載)", "背對太陽", "朝向正北方"],
      "correctAnswer": 1,
      "poeFeedback": {
        "predictionFail": "太陽能板傾斜時受光面積分散（斜射），充電效率只有不到 20%，無法啟動氮氣！",
        "scientificExplanation": "依據輻射通量密度原理 (E = E0 · sin θ)，陽光直射時能量最集中、溫度與發電效率最高；斜射時能量分散，這也是四季冷暖的主要成因！"
      }
    }
  ]
}